Today there are <mask> visions because people think more about material than spiritual things .	no
Men usually have <mask> symptoms but carry the organism in the urethra.	no
Baryons consist of <mask> quarks while mesons consist of a quark and an anti-quark.	three
Hot water can cause a third degree burn on a child in less than <mask> seconds.	three
Plants are <mask> feet apart with ten feet between rows.	four
Plants are four feet apart with <mask> feet between rows.	ten
Water can kill in <mask> ways cold shock, drowning and severe hypothermia.	three
Women have <mask> X chromosomes.	two
Caterpillars pass through <mask> to seven larval instars before they enter the pupal stage.	five
Caterpillars pass through five to <mask> larval instars before they enter the pupal stage.	seven
Average litters contain <mask> to six kittens.	three
Average litters contain three to <mask> kittens.	six
Some researchers indicate that <mask> out of five young people have had sex by the age of thirteen.	one
Some researchers indicate that one out of <mask> young people have had sex by the age of thirteen.	five
Japan sits on the intersection of <mask> tectonic plates thatgenerate a constant seismic risk.	four
Diarrhoea kills <mask> million children under five every year.	three
Diarrhoea kills three million children under <mask> every year.	five
Birds can have <mask> to twelve primaries, but the most common number is ten.	nine
Muscle burns <mask> times the calories that fat does.	eight
Most divorces take place after <mask> to five years of marriage.	three
Most divorces take place after three to <mask> years of marriage.	five
Light only penetrates the upper hundred, sometimes even only the upper <mask> meters of the water.	ten
Butterflies have <mask> large compound eyes.	two
Pets can have up to <mask> growth stages.	three
Smoking causes lung cancer in <mask> ways.	two
Every plane curve has at least <mask> vertices.	four
Age of marriage is controlled by each of the <mask> States.	four
Lemon sharks are usually <mask> to ten feet long .	eight
Lemon sharks are usually eight to <mask> feet long .	ten
Tadpoles hatch within <mask> days.	two
Puppy teeth begin to erupt until all the baby teeth are in by about <mask> to six weeks of age.	five
Puppy teeth begin to erupt until all the baby teeth are in by about five to <mask> weeks of age.	six
All hornets have <mask> sets of wings.	two
Yoga recognizes <mask> separate forms of breathing - diaphragmatic, intercostal, and clavicular.	three
Biochemical testing can easily differentiate the <mask> species.	two
Deer are born with <mask> baby teeth and develop baby incisors and premolars in their first months.	four
Radians have <mask> dimensions .	no
Rock cavies become sexually mature when they are about <mask> to three months old.	one
Rock cavies become sexually mature when they are about one to <mask> months old.	three
Space is in a <mask> dimensional form.	three
Tourism is among the <mask> largest industries in each of the western states.	three
Antibiotics usually clear up impetigo in <mask> or five days.	four
Antibiotics usually clear up impetigo in four or <mask> days.	five
Educational attainment varies widely, but more than half have less than <mask> years of schooling.	six
Insects are arthropods that have a body with <mask> segments, six legs, and one set of antennae.	three
Insects are arthropods that have a body with three segments, <mask> legs, and one set of antennae.	six
Insects are arthropods that have a body with three segments, six legs, and <mask> set of antennae.	one
Water lilies can grow in water as shallow as <mask> inches and as deep as fifteen feet.	six
Boys generate <mask> times more androgen than girls do, and are more likely to develop acne.	ten
Sponges have <mask> cell types.	three
Autism is a neurological disorder that affects <mask> in every five hundred births.	one
Autism is a neurological disorder that affects one in every <mask> hundred births.	five
Some pediatricians say to wait until the baby is <mask> months old.	six
Practical shooting is based around <mask> equally important aspects of accuracy, power and speed.	three
Group communication exists among <mask> or more people who have some common purpose.	three
Cellular respiration occurs in <mask> parts.	three
Wind speed is measured using either of <mask> instruments.	two
Capital letters account for only <mask> percent of all letters in written English.	five
Right whales are slow swimmers, averaging just <mask> miles per hour.	six
Perennial plants live for more than <mask> years.	two
Cells synthesize purine nucleotides in <mask> ways.	two
Giraffes grow for <mask> years until they reach their maximum height.	ten
Some houses have as many as <mask> people living in one room.	ten
Some houses have as many as ten people living in <mask> room.	one
Olympic softball consists of <mask> teams from all around the world.	eight
Jersey has <mask> breeding seabird species, of which seven nest on the north coast.	nine
Jersey has nine breeding seabird species, of which <mask> nest on the north coast.	seven
Poverty impacts on the environment in <mask> ways.	two
Bacteria come in <mask> basic shapes.	three
Calves are born <mask> and a half months after mating.	eight
Medflies usually live for about <mask> to three weeks.	two
Medflies usually live for about two to <mask> weeks.	three
Mangroves dominate <mask> quarters of tropical coastlines.	three
Camels can survive up to <mask> months without food or water.	six
Bears stand on <mask> feet.	two
Cubs emerge from the den when they are <mask> to six months old.	four
Cubs emerge from the den when they are four to <mask> months old.	six
Asbestos is a generic term used to describe the fibrous form of <mask> different minerals.	six
Autism is a severe life-long disability that typically occurs in the first <mask> years.	three
Electrons have almost <mask> mass and are negatively charged.	no
Time is a wheel with <mask> spokes.	seven
Minarets are in the courtyard s <mask> corners.	four
Testicles have <mask> important jobs in the body.	two
Bears have <mask> enemies other than humans.	no
Daylily leaves are grass-like, usually <mask> feet long.	two
Some mounds contain <mask> eggs and are referred to as test redds, false redds, or scrapes.	no
Blood pressure is measured with <mask> numbers.	two
Skyscrapers are <mask> story buildings.	three
Industrial halocarbons are effective ozone-depleters for <mask> reasons.	two
Snails can sleep for <mask> years without eating.	three
Toucans adapt to their ecosystems by first finding the <mask> resources needed for survival.	four
Footprints are the size of an elephant and has <mask> toes or claw marks.	three
Optometrists attend <mask> years of optometry school before starting practice.	four
Water is forced through a system which breaks it into drops as small as <mask> microns.	five
Women can have only <mask> baby each nine months, plus recovery time.	one
Women can have only one baby each <mask> months, plus recovery time.	nine
Mature plants can be up to <mask> feet tall.	six
All insects have six legs and <mask> unique body sections.	three
Battledores come in <mask> types, female and male.	two
Durable goods are new or used items generally with a normal life expectancy of <mask> years or more.	three
Marital rape is defined in <mask> ways.	two
Major depression strikes <mask> in four women, and one in ten men during their lifetime.	one
Major depression strikes one in <mask> women, and one in ten men during their lifetime.	four
Major depression strikes one in four women, and <mask> in ten men during their lifetime.	one
Major depression strikes one in four women, and one in <mask> men during their lifetime.	ten
Water is found in all <mask> states or phases on the Earth.	three
Men die from suicide at <mask> times the rate of women.	four
Geological faults exist where <mask> plates come into contact.	two
Knowledge interacts with consciousness on <mask> levels.	two
Tobacco use is responsible for nearly <mask> in five deaths in the United States.	one
Tobacco use is responsible for nearly one in <mask> deaths in the United States.	five
Most turbines have either <mask> or three blades.	two
Most turbines have either two or <mask> blades.	three
Phonology has <mask> levels.	two
Brick chimneys hide a system that circulates air in and out of the building every <mask> minutes.	six
Pigeons can raise <mask> to five broods annually.	four
Pigeons can raise four to <mask> broods annually.	five
Sound waves travel up to <mask> times faster through water than through air.	five
Concentricity is <mask> for a 'perfect' tube.	zero
Microorganisms are classified into <mask> major groups.	four
All evening primroses have <mask> petals and they open in early evening.	four
Parliamentary democracy is less than <mask> years old in Nigeria.	two
Humans brains are about <mask> times bigger than in chimpanzees.	three
Natural chromium contains <mask> isotopes.	four
All earwigs have <mask> hooked legs.	six
Mosquitoes can develop in any standing water that lasts more than <mask> days.	four
Social organization is complex, described as being structured into <mask> levels.	three
Air quality is important to long term economic growth for <mask> reasons.	three
Water seems magical because it changes form and is found in <mask> states of existence.	three
Feed kittens shortly after they wake up, and adult cats <mask> hours after they wake up.	eight
Female waterbucks reach maturity at the age of <mask> years.	three
Men live on average about <mask> years less than women in most developed countries.	seven
Studies show that <mask> out of ten school-age children walk in their sleep at least once a week.	one
Studies show that one out of <mask> school-age children walk in their sleep at least once a week.	ten
Some herpesvirus genomes exist as a mixture of <mask> isomers.	four
Arthropods are made up of <mask> groups of living animals and one group of extinct animals.	four
Arthropods are made up of four groups of living animals and <mask> group of extinct animals.	one
Worms have <mask> main characteristics.	two
Water deprivation involves consuming <mask> fluids for a period of time.	no
Malignant melanoma causes <mask> out of seven skin cancer deaths.	six
Malignant melanoma causes six out of <mask> skin cancer deaths.	seven
Sexual reproduction requires the presence of <mask> mating types.	two
Many physicists believe that the neutrino, like a photon, has <mask> mass at all.	no
Neurologists divide multiple sclerosis into <mask> types.	two
Australian colonies can have <mask> million termites.	two
Mothers nurse their babies, even underwater, for about <mask> months.	eight
Most cod are between <mask> and twelve pounds as adults, and weigh between four and ten pounds.	six
Most cod are between six and twelve pounds as adults, and weigh between <mask> and ten pounds.	four
Most cod are between six and twelve pounds as adults, and weigh between four and <mask> pounds.	ten
Lubricated condoms are effective for a maximum of <mask> years after the date of manufacture.	five
Isopods are gray in color with a shell-like body and have <mask> pairs of legs.	seven
Sage grouse are big birds, with some males approaching <mask> pounds.	eight
Economic liberalization fuels the drug trade in at least <mask> ways.	four
Homosexual men are <mask> times more likely to have attempted suicide than heterosexual men.	six
Women have <mask> senses, men five.	six
Large bulbs can produce as many as <mask> flower stalks.	three
Older people have <mask> times more tooth decay than children.	three
Ticks mature in <mask> stages, moving from egg to larva and nymph to adult.	four
Most deer develop their largest antlers between the ages of <mask> and six years.	four
Most deer develop their largest antlers between the ages of four and <mask> years.	six
Rape occurs every <mask> minutes in the United States.	six
Grasshoppers can jump <mask> feet high and four feet forward.	two
Grasshoppers can jump two feet high and <mask> feet forward.	four
Copolymers last <mask> to three years.	two
Copolymers last two to <mask> years.	three
Women are <mask> times more likely than men to develop osteoporosis.	four
Most dinoflagellates are unicellular forms with <mask> flagella .	two
Quarks also come in <mask> 'colours', terms for a property a little like electrical charge.	three
Ozone is a form of molecular oxygen that consists of <mask> oxygen atoms linked together.	three
Plants grow through precisely spaced and sized holes in top and each of the <mask> sides.	four
Enlightenment enriches all <mask> of the values that define human aspirations.	eight
Horses are creatures with <mask> legs.	four
Parvo can survive in the environment for as long as <mask> months.	six
Caramels release <mask> times more flavour with hot chocolate.	three
Braided breads start with an even number of ropes as four, <mask> or eight.	six
Moths typically have <mask> pairs of wings covered in scales.	two
Maxillary molars have <mask> buccal cusps and two lingual cusps.	two
Maxillary molars have two buccal cusps and <mask> lingual cusps.	two
Most anoles are said to live between <mask> and eight years.	four
Most anoles are said to live between four and <mask> years.	eight
Matter exists in <mask> states solids, liquids, and gases.	three
Most children improve in <mask> to seven days.	three
Most children improve in three to <mask> days.	seven
Most children stop wetting the bed at night by the time they are <mask> or five.	four
All compound microscopes contain <mask> magnifying lenses and work similarly.	two
Pacific halibut grow much larger than California halibut, over <mask> feet over a hundred pounds.	four
Black rhinos have <mask> horns, one longer than the other.	two
Black rhinos have two horns, <mask> longer than the other.	one
Neuroblasts delaminate in <mask> waves spanning approximately three hours.	five
Neuroblasts delaminate in five waves spanning approximately <mask> hours.	three
Female cats have <mask> X-chromosomes.	two
Minerals can also have two, three, <mask> or six cleavage planes.	four
Minerals can also have two, three, four or <mask> cleavage planes.	six
Most babies start drinking from a cup between <mask> and nine months of age.	six
Most babies start drinking from a cup between six and <mask> months of age.	nine
Bees possess <mask> eyes.	five
Reclaimed water is sewage water that has been treated and disinfected using <mask> different methods.	four
Alcoholics are <mask> times as likely to be male as female.	three
Marakoopa cave is a large cavern with <mask> underground streams.	two
All primates have <mask> fingers on each hand.	five
Juveniles reach sexual maturity at <mask> years of age.	five
Reds can benefit from <mask> to nine years' aging .	seven
Reds can benefit from seven to <mask> years' aging .	nine
Optical isomers differ in the arrangement of <mask> groups around a chiral carbon.	four
Interdigital glands are present on all <mask> feet, and are slightly larger on the front feet.	four
Animal products contain <mask> carbohydrates at all.	no
Snakes have <mask> layers of skin.	three
Clustering takes many forms, and can scale from <mask> computers.	two
Death can occur within <mask> hours in children.	five
Unconsciousness can take place within <mask> to two minutes.	one
Unconsciousness can take place within one to <mask> minutes.	two
Muscular strength is tested on <mask> major muscle groups.	six
Bucks grow antlers each year that reach <mask> to six feet in spread.	five
Bucks grow antlers each year that reach five to <mask> feet in spread.	six
Modern guitars come in <mask> main types.	four
Ocean water contains <mask> times more salt than the human body can safely ingest.	seven
Raspberries come in <mask> colors, red, yellow, purple and black.	four
Some people have <mask> symptoms until the liver has been quite severely damaged.	no
Chronic infections cause about <mask> percent of cancer cases, mostly in developing countries.	nine
Genetic equilibrium is always true if <mask> specific conditions are met.	five
Top reds improve with as much as <mask> years' aging .	ten
Topical steroids come in <mask> different strengths, mild, moderately potent, potent and very potent.	four
Studies show that women are <mask> times more likely to report ill than men.	four
Rheumatic fever begins <mask> to six weeks after an untreated streptococcal infection.	one
Rheumatic fever begins one to <mask> weeks after an untreated streptococcal infection.	six
Cichlids like to eat - there's <mask> ways about it.	two
Bobcats have very short tails, only <mask> to seven inches long.	three
Bobcats have very short tails, only three to <mask> inches long.	seven
Fear has <mask> traits.	two
Pinks live only <mask> years.	two
Process color uses a combination of <mask> separate inks to create a full-color image.	four
Information collected by the <mask> senses comes into the brain from the spinal cord to the cortex.	five
Echinoderms have radial symmetry , many having <mask> or multiples of five arms.	five
Echinoderms have radial symmetry , many having five or multiples of <mask> arms.	five
Most bioluminescence is blue for <mask> reasons.	two
Females are able to conceive <mask> to four months after calves are weaned.	three
Females are able to conceive three to <mask> months after calves are weaned.	four
Local government is administered by <mask> district councils and five town councils.	nine
Local government is administered by nine district councils and <mask> town councils.	five
Most dogs start to mature at <mask> to three years.	two
Most dogs start to mature at two to <mask> years.	three
Catbirds are usually around <mask> inches in length and common in undergrowth, brush, and gardens.	nine
Women taking vitex for <mask> months appear to have more success at becoming pregnant.	three
Rats reach puberty very young at <mask> to eight weeks of age.	six
Rats reach puberty very young at six to <mask> weeks of age.	eight
Postpartum blues are common during the <mask> months after childbirth.	three
Pimps have <mask> ways of holding on to women.	two
Tornado intensity is measured on a scale of <mask> to five, with five the strongest.	zero
Tornado intensity is measured on a scale of zero to five, with <mask> the strongest.	five
Crabs have <mask> legs.	ten
Sharks can have from <mask> to seven gills.	five
Sharks can have from five to <mask> gills.	seven
Cofactors are divides into <mask> categories, one being coenzymes.	two
Cofactors are divides into two categories, <mask> being coenzymes.	one
Nymphs pass through <mask> nymphal instars before molting into the adult stage.	five
Dunes are of <mask> types - linear and parabolic.	two
Thin walls develop around <mask> of the nuclei.	six
Mites can survive off the body for up to <mask> days.	five
Biennials complete their life cycle in <mask> years a.	two
Figure skating is like flying, but it's also like climbing hundreds of stairs in <mask> minutes.	four
Gray fox vixens usually give birth to <mask> or four pups at a time.	three
Gray fox vixens usually give birth to three or <mask> pups at a time.	four
Diprotic acids can release <mask> hydrogen ions per molecule.	two
Many infected dogs exhibit <mask> symptoms until the disease is in an advanced state.	no
Lemurs live in troops of <mask> and five individuals.	two
Lemurs live in troops of two and <mask> individuals.	five
Some clouds are so thick and dense that <mask> stars can shine through.	no
Fuzzy logic is an attempt to combine the <mask> techniques.	two
Polyploids are plants with more than <mask> sets of chromosomes.	two
Ants have <mask> pairs of legs, all originating in the thorax.	three
Leeches usually have <mask> jaws and make a Y-shaped incision.	three
Cetaceans are noted for their play behavior, seemingly pleasurable activities with <mask> serious goal.	no
Millipedes have <mask> per body segment and they have lots of body segments.	four
Sharpshooters are a mix of powder burners and <mask> year old kids.	five
New species are believed to arrive in the Mediterranean at the rate of <mask> to five annually.	four
New species are believed to arrive in the Mediterranean at the rate of four to <mask> annually.	five
Cleavage is fair in <mask> directions forming octahedrons.	four
Covalent compounds are <mask> non metals put together.	two
Monkeys are much more resistant and can live up to <mask> minutes.	five
Humans display all <mask> features characteristic of chordates during their embryonic phase.	four
Some adjectives have <mask> forms, others have four.	two
Compounds consist of <mask> or more elements in fixed proportions.	two
Miniature cattle are classified in <mask> categories as measured by height at the hip.	three
Ignorance exists in <mask> forms .	two
Vegetation has <mask> important aspects that are subject to change.	three
Snake venom works on victims in <mask> main ways.	two
Humans stand upright and walk on <mask> legs.	two
Most ants have <mask> such eyes on the vertex of the cranium, placed in a triangle.	three
Infected rodents carry and secrete the virus for about <mask> days.	seven
People have at least <mask> distinct intelligences.	seven
Some people say they see things in <mask> spatial dimensions.	three
Frogs commonly have <mask> legs and one foot on each leg.	four
Frogs commonly have four legs and <mask> foot on each leg.	one
Striped whipsnakes seem to prefer temperatures from seventy <mask> to ninety nine degrees Fahrenheit.	five
Striped whipsnakes seem to prefer temperatures from seventy five to ninety <mask> degrees Fahrenheit.	nine
Iranian men can lawfully have <mask> wives.	four
Sparse matrices are matrices that contain a relatively large number of <mask> entries.	zero
Telic verbs have <mask> stems, while atelic verbs have one.	two
Most females are sexually mature at about <mask> to six years.	five
Most females are sexually mature at about five to <mask> years.	six
Time based licenses are typically licenses that expire within <mask> to three years.	one
Time based licenses are typically licenses that expire within one to <mask> years.	three
Blood is made up of <mask> parts.	four
Frozen grafts can have a shelf life of up to <mask> years.	five
Mammals have only <mask> sets of teeth.	two
Ozone is an invisible gas composed of <mask> atoms of oxygen.	three
Planaria have <mask> tiny eyes on the head.	two
Nymphs progress through <mask> instars before becoming adults.	five
Nymphs feed for <mask> to eight weeks before entering the adult stage.	five
Nymphs feed for five to <mask> weeks before entering the adult stage.	eight
Medial moraine is formed from <mask> lateral moraines.	two
Ritual circumcision occurs in the rst <mask> weeks of life.	two
Men have little or <mask> rites when they are victims of domestic violence.	no
Barn owls eat about <mask> rats or mice a day.	three
Joint life is a policy that covers <mask> lives.	two
Instinct drives men to achieve success in <mask> key areas of their lives.	five
Elk retain their antlers for more than <mask> months of the year.	six
Trees have <mask> ways to spread their seeds.	four
Plants generally live <mask> years but sometimes longer.	two
Most cats have only <mask> to five toes per paw, depending on whether it is the front or back paw.	four
Most cats have only four to <mask> toes per paw, depending on whether it is the front or back paw.	five
Rats only live about <mask> years.	two
Cancer affects <mask> in three of the UK population.	one
Cancer affects one in <mask> of the UK population.	three
Religions can provide many answers about how a person can live, but <mask> explanations about why.	no
Women purposely injure themselves <mask> to four times more often than men.	three
Women purposely injure themselves three to <mask> times more often than men.	four
Home ownership adds to the economy in <mask> ways.	two
Most infected people show <mask> symptoms or have mild symptoms of disease.	no
Thermal equilibrium is when <mask> systems reach same temperature.	two
Ants have <mask> castes, namely queens, males and workers.	three
Roaches can run as fast as <mask> miles per hour and can swim.	three
Plants synthesize <mask> types of polysaccharides, starch and cellulose.	two
Dark chocolate has more than double that amount and cocoa powder has <mask> times that amount.	four
Cells have <mask> kinds of nuclei.	two
Natural molybdenum contains <mask> isotopes.	seven
Oar boats are smaller than motor boats and can accommodate <mask> to five people.	four
Oar boats are smaller than motor boats and can accommodate four to <mask> people.	five
Grease makes food <mask> times harder to digest.	seven
Female gorillas give birth to <mask> infant after a pregnancy of nearly nine months.	one
Female gorillas give birth to one infant after a pregnancy of nearly <mask> months.	nine
Stem cells form when an embryo is <mask> days old, and go on to make up every part of the body.	four
Raspberries are considered a high-fiber food at over <mask> grams of dietary fiber per cup.	eight
Wing feathers are now <mask> months old and continue to fade and wear.	nine
Laminitis occurs in <mask> stages.	three
Secondary aluminum uses <mask> percent of the energy required to produce primary aluminum.	five
Prokaryotes mean they have <mask> nucleus in which they store genetic material.	no
Healthy people can donate blood as often as once every <mask> weeks.	eight
Sexual reproduction needs <mask> parents, a male and a female.	two
Lizards generally have <mask> legs and movable eyelids.	four
Peach scab causes minor losses in mid-Atlantic orchards but can build up if <mask> fungicides are used.	no
Water weighs about <mask> pounds per gallon.	ten
Bilinear interpolation uses a weighted average of the <mask> nearest pixels.	four
Stripers reach maturity at approximately <mask> years of age.	three
Virtual chaos defines the cosmos as <mask> dimensional torque and consciousness.	ten
Zirconia can exhibit <mask> different crystal structures depending on temperature.	three
Animal cages are simple roofed cage blocks, each typically containing <mask> contiguous cages.	five
