Most lakes stratify into <mask> layers during late spring, staying that way until late fall.	three
Polypropylene comes in <mask> types.	two
Triglycerides appear in <mask> forms, saturated and unsaturated.	two
Oysters also have <mask> separate sexes, males and females.	two
Atypical hyperplasia increases the risk about <mask> to eight-fold.	four
Leprechauns supposedly carry <mask> leather pouches.	two
Colon cancer has <mask> main symptom complexes.	four
Pups lose baby teeth starting about <mask> months of age.	three
Primates have <mask> digits on their forelimbs.	five
Most species have <mask> toes, three of which are forward-pointing.	four
Most species have four toes, <mask> of which are forward-pointing.	three
Many infected people have <mask> symptoms at all.	no
String theory has <mask> defining features.	two
Centipedes develop slowly, sometimes with <mask> or more molts occurring before they mature.	seven
Bipolar pacemakers have <mask> electrodes at the catheter tip.	two
Legless larvae hatch out in about <mask> days.	four
Meditation awakens the soul awareness in the <mask> chakras.	seven
Biennials complete their life cycle in <mask> growing seasons.	two
Most stars have <mask> rays.	four
Most sonar transducers have <mask> resonant points.	three
Perjury is punishable by imprisonment in state prison for two, <mask> or four years.	three
Perjury is punishable by imprisonment in state prison for two, three or <mask> years.	four
Maize streak is harmless if it occurs more than <mask> weeks after the maize crop has germinated.	eight
G is connected and has <mask> cycles .	no
Bobcats also have the ability to jump fences <mask> feet or more in height.	six
Several embryos are transferred into the uterus after <mask> to five days.	three
Several embryos are transferred into the uterus after three to <mask> days.	five
Mental illness affects approximately <mask> in four people throughout their lifespan.	one
Mental illness affects approximately one in <mask> people throughout their lifespan.	four
Ozone is a simple triatomic, reactive molecule formed from <mask> oxygen atoms.	three
Children learn more during the first <mask> years of life than at any other time.	five
Many infections have <mask> symptoms and are only detected by the doctor during an annual pelvic exam.	no
Monarchs go through a complete metamorphosis in <mask> to six weeks.	three
Monarchs go through a complete metamorphosis in three to <mask> weeks.	six
Children usually become functionally blind within <mask> years of diagnosis.	three
Pickpockets often work in teams of <mask> or three.	two
Woodchucks produce about <mask> young and virtually all females breed annually.	four
Primates have <mask> individual toes.	five
Account is a <mask> character code that describes the basic accounting classifications.	six
Hyperlipidemia usually occurs within the initial <mask> to four weeks.	two
Hyperlipidemia usually occurs within the initial two to <mask> weeks.	four
Mice form the reactive intermediates <mask> times faster than rats and man.	ten
Children can drown in less than <mask> inches of water.	two
Libertarianism provides <mask> basis for a national leader.	no
Nondurable goods are items generally with a normal life expectancy of less than <mask> years.	three
Some parents start giving spending money or allowances to young children with <mask> strings attached.	no
Female tigers have a litter about once every <mask> years.	two
Photons have momentum but <mask> mass or electrical charge.	no
Families headed by women are nearly <mask> times more likely to be poor than other families.	five
Some electric shavers are dry shavers so <mask> gels or lotions are needed in preparation.	no
Many babies start crawling between <mask> and ten months of age.	seven
Many babies start crawling between seven and <mask> months of age.	ten
Some people use <mask> reticules, one in each eyepiece.	two
Some people use two reticules, <mask> in each eyepiece.	one
Herbs require at least <mask> hours of sunlight.	six
Raptors usually have <mask> talons pointing forward and one talon pointing backward.	three
Raptors usually have three talons pointing forward and <mask> talon pointing backward.	one
Rectifier diodes have <mask> contact-terminals, an anode and a cathode.	two
Trappers have <mask> genders and reproduce sexually.	two
Porcupines have <mask> areas of conflict with humans.	two
Numbers are the mean of <mask> or six observations.	five
Numbers are the mean of five or <mask> observations.	six
Tamarind trees yield fruits for more than <mask> centuries.	two
Some species have vestigial tails or <mask> tails at all.	no
Some films have an older age limit than <mask> years.	seven
Life expectancy is around <mask> years.	ten
High ankle sprains, on the other hand, can remain symptomatic for as long as <mask> months.	nine
Swedish massage utilizes about <mask> different hand movements upon the body.	four
Polyester has <mask> favorable properties.	two
Complete darkness is only possible at absolute <mask> .	zero
Modern scientists recognize <mask> main subclasses of prairie in Illinois.	six
Giant pandas are perhaps the most unusual of the world's <mask> species of bears.	eight
Tantric theory holds that sexual energy passes through <mask> parts of the body known as chakras.	seven
Most butterflies live only <mask> to four weeks.	two
Most butterflies live only two to <mask> weeks.	four
Water goes through <mask> different states in the water cycle.	three
Gregorian chants are divided into <mask> types based on the number of notes sung to each syllable .	three
Child mortality includes deaths within the first <mask> years after birth.	five
Sound travels almost <mask> times faster in water than in air.	five
Domestic violence makes <mask> distinctions in terms of education level, social status or religion.	no
Water is an essential nutrient and it contains <mask> calories.	zero
Japan has <mask> to four thousand islands.	three
Japan has three to <mask> thousand islands.	four
Some babies spend <mask> to nine months after their due dates in the nursery.	six
Some babies spend six to <mask> months after their due dates in the nursery.	nine
Earth is divided into <mask> general layers.	three
Squids usually live from <mask> to five years.	three
Squids usually live from three to <mask> years.	five
Walden plants come in diameters ranging from <mask> feet to twelve feet.	six
Brazil has <mask> million rural poor who have no access to land.	ten
Brazil has ten million rural poor who have <mask> access to land.	no
Equivalent Fractions Are <mask> fractions with the same area.	two
Bivalves have <mask> distinct shells joined by a ligament.	two
Citrus is a male orange tabby, <mask> months old.	three
Children are most vulnerable to the sun during their first <mask> years.	ten
Elliptical galaxies consist of old stars and have little or <mask> gas and dust.	no
Genes perform <mask> functions.	two
Recycling plastic uses only <mask> to ten percent as much energy as manufacturing new plastic.	five
Recycling plastic uses only five to <mask> percent as much energy as manufacturing new plastic.	ten
Shared spaces are offices that <mask> or three workers share.	two
Shared spaces are offices that two or <mask> workers share.	three
Chickens take about <mask> to eight weeks to grow.	six
Chickens take about six to <mask> weeks to grow.	eight
Gluons have <mask> colors, one normal color and one anti-color.	two
Gluons have two colors, <mask> normal color and one anti-color.	one
Gluons have two colors, one normal color and <mask> anti-color.	one
Startup latency is the constant commicationn overhead incurred in sending a <mask> length message.	zero
Some species have short, useless wings, and others have <mask> wings at all.	no
Selenium exists in several allotropic forms, although <mask> are generally recognized.	three
Humans have <mask> breasts .	two
Fission is illustrated in A to D, which represent <mask> stages in fission in a European species.	four
Bovine colostrum is <mask> times richer in immune factors than human colostrums.	ten
Fish have <mask> eyelids and their eyes are sensitive to the glare of the sun.	no
Scallops have a shelf life of <mask> to three days.	two
Scallops have a shelf life of two to <mask> days.	three
Acrylics are water-based and dry in <mask> to four hours.	two
Acrylics are water-based and dry in two to <mask> hours.	four
Martial arts are multi-sensory, combining all <mask> modalities in classes.	three
Most people sell or refinance their home within <mask> to twelve years.	six
Misdemeanours are less serious offences which can lead to imprisonment for up to <mask> months.	three
Earthquakes are most frequent where <mask> or more plates meet.	two
Plants also provide the <mask> basic needs of most wildlife.	four
Hair does grow for <mask> to six years before falling out.	three
Hair does grow for three to <mask> years before falling out.	six
Cellular respiration takes place in <mask> main stages.	three
Bees can memorise at least <mask> locations, and three paths leading to each.	six
Bees can memorise at least six locations, and <mask> paths leading to each.	three
Female armadillos have exactly <mask> babies of the same sex at a time.	four
Pluralism Comes in <mask> forms.	two
Dinoflagellates are unicellular forms with <mask> to three flagellae .	one
Dinoflagellates are unicellular forms with one to <mask> flagellae .	three
Cortical amplitudes range from less than <mask> up to seven or more microvolts.	one
Cortical amplitudes range from less than one up to <mask> or more microvolts.	seven
Natural selection is based on <mask> basic facts about plants and animals in nature.	three
Garlic mustard has a <mask> year life cycle.	two
Verbs have <mask> functions in sentences.	two
Veterinary experts estimate that nearly <mask> in five adult dogs suffers from osteoarthritis.	one
Veterinary experts estimate that nearly one in <mask> adult dogs suffers from osteoarthritis.	five
Spirituality is there to gain control over the <mask> senses.	five
Carrots can take up to <mask> weeks to germinate.	three
Most schools accept children from between ages <mask> years to three years and six months.	three
Most schools accept children from between ages three years to <mask> years and six months.	three
Most schools accept children from between ages three years to three years and <mask> months.	six
Most people get their flu shots in the last <mask> months of the year.	three
Daisies are open to young girls who are in kindergarten or <mask> years old.	five
Honey bees cause concern under <mask> circumstances.	two
Influenza viruses undergo <mask> kinds of change.	two
Prairie voles look like rodents with small rounded bodies, <mask> short legs and a short tail.	four
Feathers replace their down coats in <mask> to five weeks.	three
Feathers replace their down coats in three to <mask> weeks.	five
Natural gadolinium is a mixture of <mask> isotopes.	seven
Dolphins can hold their breath for <mask> to eight minutes.	five
Dolphins can hold their breath for five to <mask> minutes.	eight
Boys are <mask> times more likely than girls to have autism.	four
Camels have <mask> stomachs.	three
Women usually inherit <mask> X chromosomes-one from each parent.	two
Tropical rainforests exist on <mask> continents.	four
Collisions result in a compression force, pushing <mask> plates together.	two
Metals typically react with two, four, or <mask> ligands.	six
Worms can have up to <mask> hearts.	ten
Aridity presents <mask> main obstacles to solitary behavior.	two
Metabolism have <mask> stages-catabolism and anabolism.	two
Hummingbirds eat every <mask> minutes to keep up with there high metabolism.	ten
Some species live in the water as nymphs for <mask> years before they hatch into their adult stage.	three
Most leprechauns live to be about <mask> hundred years old.	three
Dinoflagellates are photosynthetic creatures surrounded by <mask> separate membranes.	three
Some atoms have too many electrons, <mask> or two extra.	one
Some atoms have too many electrons, one or <mask> extra.	two
All sugars contain <mask> calories per gram.	four
Pigmentation is a good indicator of egg production for the first <mask> months a bird has been laying.	six
Kissing bugs have <mask> legs.	six
Deified angels inhabit heavens <mask> to six.	two
Oceans make up over <mask> thirds of the Earth's surface.	two
Electromagnetic interference takes into <mask> forms, Conducted and Radiated.	two
Female bats nurse their young for <mask> to eight weeks.	six
Female bats nurse their young for six to <mask> weeks.	eight
Wolverine tracks are similar to wolf prints, but a wolf has <mask> toes, whereas a wolverine has five.	four
Compound objects have <mask> representations themselves.	no
Aborigines form <mask> per cent of the population.	two
Planes work in <mask> dimensions, but a boat is limited to two.	three
Most women have <mask> symptoms of heart disease with mitral valve prolapse.	no
Some cancers do recur, most often within <mask> years of the original diagnosis.	five
Liberated souls have <mask> karmas and therefore, they are no longer in the cycle of births and deaths.	no
Liberated souls have no karmas and therefore, they are <mask> longer in the cycle of births and deaths.	no
Ternary diagrams show the relative proportions of <mask> variables on three axes.	three
Ternary diagrams show the relative proportions of three variables on <mask> axes.	three
Most vegetable seeds germinate in <mask> to six days.	three
Most vegetable seeds germinate in three to <mask> days.	six
Air is a masculine element and governs the magick of the <mask> winds.	four
Toads have <mask> mating seasons per year producing many, many toads.	three
Recent studies confirm that <mask> out of four children are obese.	one
Recent studies confirm that one out of <mask> children are obese.	four
Water exists in <mask> states.	three
Growth generally begins during the first <mask> weeks of life and continues for about one year.	six
Growth generally begins during the first six weeks of life and continues for about <mask> year.	one
Tropical rainforests occur in <mask> major geographical areas around the world.	three
Cardinals have <mask> main functions in the church.	three
Some theosophists say at <mask> years after birth.	two
Cervical cancer is <mask> times more common in poor women than in the most affluent.	three
Every dog has <mask> weeks and a day to be adopted, but after that, it is put to sleep.	four
Age of onset is after <mask> months of age.	three
Proteins are long chains of amino acids folded into <mask> dimensional shapes.	three
Teleportation is performed if the <mask> detectors simultaneously register photons.	two
Menstruation usually lasts between <mask> and seven days.	three
Menstruation usually lasts between three and <mask> days.	seven
Comparative advantage is the ability to perform an activity at a <mask> opportunity cost.	zero
Multicellular eukaryotes are made of <mask> fundamental cell types.	two
Coriolis force is <mask> at the equator and increases with latitude to a maximum at the poles.	zero
Medial moraines are formed when <mask> glaciers meet.	two
Poles CAN occur at <mask> frequency.	zero
Most sailing ships have between <mask> and three mast but some have four.	one
Most sailing ships have between one and <mask> mast but some have four.	three
Angiograms require staying in the hospital about <mask> hours from start to finish.	seven
Fuzzy logic has <mask> different meanings.	two
Ligation is the process of permanently attaching the <mask> pieces.	two
Most spiders can live <mask> or two years.	one
Most spiders can live one or <mask> years.	two
Many addicts use opium because they have <mask> access to public health care facilities.	no
Mothers are <mask> times more likely to hemorrhage.	three
Longevity favors gender Four out of every <mask> centenarians are women.	five
Sportswear is more than <mask> times the size of the dress shirt market.	three
Fertilization occurs through pollen-tubes with <mask> male nuclei.	two
Babies frequently take up to <mask> years to completely heal.	two
Alcoholics are <mask> times more likely to be involved in fatal accidents than non-alcoholics.	seven
Energy is lost via <mask> mechanisms.	three
Annual flowers love rich soil loosely dug <mask> or more inches deep.	eight
Sin divides minds into <mask> halves.	two
Top predators are at the top of the food chain and have <mask> predators of their own.	no
Chromatography is unique because of <mask> reasons.	three
Female orangutans are considerably shorter, with an average height of just <mask> feet.	three
Marigolds require at least <mask> hours of daily sunlight to flower at their best.	six
Psychology is founded on <mask> false premises that are all humanistic from the core.	eight
Tequila comes in <mask> basic quality levels - silver, gold and anejo.	three
Most sperm have a group of <mask> mitochondrial clumps in the midpiece.	five
Caterpillars feed actively on broadleaf trees for <mask> to six weeks.	five
Caterpillars feed actively on broadleaf trees for five to <mask> weeks.	six
Ligand seeks <mask> receptors into binding and mutual phosporylation.	two
Nymphs have <mask> instars requiring three years for the life cycle.	eight
Nymphs have eight instars requiring <mask> years for the life cycle.	three
Baseball has <mask> eras.	three
Horses walk on <mask> hoofed toe, and rhinos walk on three toes.	one
Horses walk on one hoofed toe, and rhinos walk on <mask> toes.	three
Bulls can stand as tall as <mask> feet at the shoulders.	five
Any elliptical orbit has <mask> apsides.	two
Zinnias grow best in full sun, which means <mask> or more hours of direct sun daily.	six
Vegans eat only plant foods, <mask> eggs or dairy products.	no
Every triangle has <mask> vertices.	three
Mixtures are physical combinations of at least <mask> pure substances.	two
Secularism is the principle that there exist <mask> gods or purely spiritual entities.	no
Most people start to have symptoms about <mask> or six weeks after exposure.	five
Most people start to have symptoms about five or <mask> weeks after exposure.	six
Life begins <mask> months earlier at conception when an individual human being comes into existence.	nine
Scriptures speak of at least <mask> ages to come.	two
Horses have <mask> incisors per quadrant.	three
Corporations have <mask> laws that control their morality or ethics.	no
Most blue stars are young and hot, up to <mask> times hotter than our Sun.	ten
Seals swim to the surface to breathe every <mask> to fifteen minute.	five
Insects have six legs and <mask> body segments.	three
Some hunters go all <mask> days without bagging one white tail.	six
Some hunters go all six days without bagging <mask> white tail.	one
Sharks have <mask> different types of fins.	five
Cacomistles live anywhere between <mask> and twenty-three years.	seven
Many flightless birds have only <mask> toes, the African ostrich but two.	three
Sustainable development has <mask> components - environment, society, and economy.	three
Most herbal formulas contain <mask> to twelve herbs in various combinations.	six
Democracy is <mask> wolves and a sheep voting on lunch.	two
Smokers die <mask> times more often from ruptured aneurysms than nonsmokers.	four
Cows have four stomachs, and the first <mask> yield merchantable tripe.	three
Chicory is a hardy vegetable that is used in <mask> basic forms.	three
Spiders have a body of <mask> distinct sections.	two
Science is organized into <mask> units in which inquiry and discovery are the focus.	four
Japan has numerous volcanoes, about <mask> hundred, and many earthquakes.	two
Motive power is of <mask> kinds.	two
Laughter first appears around <mask> to four months in response to active stimuli.	three
Laughter first appears around three to <mask> months in response to active stimuli.	four
Gerbils walk and scamper on all <mask> limbs and flee in running leaps when alarmed.	four
Pups only stay with their parents for around <mask> months.	two
Anorexics see the world as black and white, and <mask> shades of gray.	no
Most mammalian species have between <mask> and fifteen types of Toll-like receptors.	ten
Cows breed at <mask> years, bulls at four.	three
Most spiders have <mask> eyes, and the jumping spiders have the best eyesight of all.	eight
Most polar bears sleep for <mask> to eight hours at a stretch and they take naps, too.	seven
Most polar bears sleep for seven to <mask> hours at a stretch and they take naps, too.	eight
Mutations usually occur only once in every <mask> million duplications of a DNA molecule.	ten
Blood donors can give blood every <mask> weeks, or six times a year.	eight
Blood donors can give blood every eight weeks, or <mask> times a year.	six
Food stamps come in colors like blue for a <mask> dollar coupon and green for a ten.	five
Most carnivores can have children after <mask> or two years.	one
Most carnivores can have children after one or <mask> years.	two
Granite is an igneous rock that is composed of <mask> minerals.	four
Many swimmers train for more than <mask> years during their careers.	ten
Poplars usually are ready for use as biomass energy at <mask> years.	five
Calculators are great at giving numbers to <mask> or twelve significant digits.	ten
Numbers multiplied by <mask> are always even.	four
Most cuttlefish live to about <mask> years.	two
Ozone is a gas that is composed of <mask> atoms of oxygen.	three
Vaginal cancer is rare, accounting for only <mask> percent of all gynecologic cancers.	three
Scientists can even create oysters with <mask> sets of chromosomes, instead of the normal two.	three
Males can easily father kittens from as young as <mask> months, to over ten years.	five
Males can easily father kittens from as young as five months, to over <mask> years.	ten
Many calanoid copepods possess <mask> different modes of locomotion.	two
Closed setting is a setting which has been used where <mask> claws are used to hold the diamond.	no
Plant viruses appear to be simple organisms with as few as <mask> genes.	four
Natural lead is a mixture of <mask> stable isotopes.	four
Barbershop harmony is a style of unaccompanied singing in which <mask> voices harmonize to a melody.	three
Integer numbers unite positive and negative up to <mask> and create the number line.	ten
Women come in about <mask> times as often as men.	three
Small complexes are apartment buildings with less than <mask> units.	six
Irregular menstruation has <mask> main types.	three
Equiangular triangle is a triangle whose <mask> angles are congruent.	three
Sawflies have <mask> or more pair of prolegs, while caterpillars have less than five.	five
Globular clusters contain almost <mask> gas or dust and show few signs of recent star formation.	no
Rice is the staple diet in Nepal and around <mask> million tons are produced annually.	three
Turtles have <mask> special sets of respiratory muscles.	two
Elliptical galaxies are probably a mix of all <mask> shapes.	three
Photosynthesis has <mask> main sets of reactions.	two
Bonds also come in <mask> types.	two
Cats see <mask> times better in the dark and at night than humans.	six
Electric power means <mask> gas or oil to spill, and no pollution in the air.	no
Electric power means no gas or oil to spill, and <mask> pollution in the air.	no
Coral is a heterogeneous cluster built in <mask> phases.	three
Airplanes still fly <mask> to five times faster than zeppelins.	four
Airplanes still fly four to <mask> times faster than zeppelins.	five
Most adjective clusters contain <mask> antonymous parts.	two
Most symphonies have <mask> movements and most concertos have three.	four
Birds have absolutely <mask> ideas about human gender.	no
Commas signal the breaks between <mask> or more units in a series.	three
Rutabagas require <mask> weeks longer to mature than turnips and are best grown as a fall crop.	four
Horses gain twelve additional permanent molars from <mask> to three and a half years of age.	one
Horses gain twelve additional permanent molars from one to <mask> and a half years of age.	three
Anti depressants work differently to the benzos and they can take up to <mask> weeks to work.	six
Tricyclic pills extend the menstrual cycle to <mask> months.	three
Baseball has <mask> coaches and softball has four coaches.	four
Baseball has four coaches and softball has <mask> coaches.	four
Indoor polo uses <mask> players, and outdoor has four per team.	three
Indoor polo uses three players, and outdoor has <mask> per team.	four
Urea cycle requires the coordination of <mask> different tissues.	two
Bats sometimes emerge up to <mask> hours before sundown, forming dense columns over the hills.	three
Doublets are often a sign of <mask> written sources.	two
Shotguns range in weight from about <mask> pounds to eight pounds.	five
Shotguns range in weight from about five pounds to <mask> pounds.	eight
Chicks fly soon after hatching, but stay with their mothers and siblings for <mask> to twelve weeks.	ten
Geraniums usually require additional fertilizer during the growing season every <mask> to six weeks.	four
Geraniums usually require additional fertilizer during the growing season every four to <mask> weeks.	six
Deep marshes have water up to <mask> feet deep.	three
Most babies eat every <mask> to four hours.	two
Most babies eat every two to <mask> hours.	four
Wolves usually live in packs of <mask> to twelve.	two
Whales are at the top of the food chain and have <mask> predators other than humans.	no
Newborn kittens develop sight during the first <mask> or four weeks of life.	three
Newborn kittens develop sight during the first three or <mask> weeks of life.	four
Chloroplasts are made of <mask> types of membrane.	three
Myotubular myopathy is a rare muscle wasting disorder that occurs in <mask> forms.	three
Fires are <mask> times more likely to happen in a home than at any other location.	four
Men are more likely than women to have been off cigarettes for <mask> or more years.	five
Light appears in <mask> distinct colors known as a spectrum.	seven
