Respiratory substrates are of <mask> kinds viz., carbohydrates, fats and proteins.	three
Natural rhenium is a mixture of <mask> stable isotopes.	two
Pandas sleep <mask> to four hours a day.	two
Pandas sleep two to <mask> hours a day.	four
Colonies show <mask> different growth form 'phases'.	three
Y are <mask> morphisms of local ringed sets.	two
Every week has <mask> days, seven days, seven days.	seven
Every week has seven days, <mask> days, seven days.	seven
Every week has seven days, seven days, <mask> days.	seven
Sugar Gliders live between <mask> and fifteen years.	eight
Pork has <mask> times as much thiamin as any other food.	three
Myofibrils contain <mask> types of filaments.	two
Most Trusts have <mask> or more Trustees.	two
Nonverbal communication is present even if there are <mask> words being spoken.	no
Scorpions have pincers, <mask> legs and a long tail with a stinger at the tip.	eight
Most geckos live for about <mask> to ten years.	four
Most geckos live for about four to <mask> years.	ten
Brook stickleback have prominent mouths, large eyes and <mask> to six spines on their backs.	four
Brook stickleback have prominent mouths, large eyes and four to <mask> spines on their backs.	six
Neurofibromatosis appears in <mask> forms.	two
Dishevelled proteins lead to <mask> signaling pathways.	two
Statistics indicate that <mask> in three women and one in six men have experienced sexual abuse.	one
Statistics indicate that one in <mask> women and one in six men have experienced sexual abuse.	three
Statistics indicate that one in three women and <mask> in six men have experienced sexual abuse.	one
Statistics indicate that one in three women and one in <mask> men have experienced sexual abuse.	six
Wombats reach sexual maturity at the age of <mask> years.	two
Tadpoles hatch out within <mask> days.	two
Sexual reproduction involves <mask> gametes from different parents.	two
Washed sand has <mask> nutrients to support bacterial growth.	no
Newborn calves are approximately <mask> meters in length.	seven
Most infants become ready to try solid foods when they are between <mask> and six months of age.	four
Most infants become ready to try solid foods when they are between four and <mask> months of age.	six
State law requires that all dogs over <mask> months of age be licensed and vaccinated against rabies.	four
Ear infections are of <mask> major types.	two
Bears are flat-foot walkers with <mask> toes.	five
Dykes divide the wetland into <mask> units.	ten
Many high schools have <mask> librarians or counselors.	no
Granite occurs in <mask> separate masses.	two
Clover can live in it, and people can hunt for <mask> leaf clovers in it.	four
Insects sport <mask> appendages, and dominate the species count on our planet.	six
Plants produce seed at <mask> years of age.	eight
Influenza viruses undergo <mask> types of changes.	two
Most movements require the activation of very few muscles, around <mask> percent or ten at the most.	five
Most movements require the activation of very few muscles, around five percent or <mask> at the most.	ten
Butane has <mask> carbon atoms chained together.	four
Breast cancer strikes <mask> out of every ten American women.	one
Breast cancer strikes one out of every <mask> American women.	ten
Gibberellins are diterpenoids derived from <mask> isoprenoid units forming a system of four rings.	four
Gibberellins are diterpenoids derived from four isoprenoid units forming a system of <mask> rings.	four
Leeches can grow to be <mask> inches long.	eight
Scorpions are arachnids that possess <mask> legs.	eight
White men are <mask> times more likely to develop testicular cancer than black men.	four
Medical drugs can only kill <mask> or two parasites each.	one
Medical drugs can only kill one or <mask> parasites each.	two
Some clocks come with <mask> wire cord.	three
Mango trees grown from seed can take up to <mask> years to bear fruit.	eight
Programming occurs in all <mask> subject areas in the discipline of computing.	nine
Box turtles are official state reptiles of <mask> U.S. states.	four
Carious dentin is made up of <mask> distinct layers.	two
Norplant implants cause most women to have irregular periods and spotting for the first <mask> months.	six
Domestic violence is a <mask> way street.	two
Seeds germinate in about a month, but plants grown from seed take <mask> to five years to flower.	three
Seeds germinate in about a month, but plants grown from seed take three to <mask> years to flower.	five
Armaments manufacturers use lithium to produce tritium in <mask> ways.	two
Tadpoles undergo <mask> remarkable changes that are easy to observe.	four
Most orchids require plenty of light, preferably at least <mask> hours a day.	six
Insects are identified by having <mask> sets of paired legs, while isopods have seven.	three
Some women suffer recurrent UTIs, as many as <mask> or more a year.	three
Smoking is responsible for <mask> in five deaths in Canada.	one
Smoking is responsible for one in <mask> deaths in Canada.	five
Silver bullion is sold in <mask> different forms.	three
Some friars also live in parishes where there are <mask> friaries established.	no
Wombats measure up to <mask> feet long and weigh from thirty to seventy-five pounds.	four
Gingko trees develop seeds in <mask> ways.	two
Lions stand between <mask> and a half and four feet tall at the shoulder.	three
Lions stand between three and a half and <mask> feet tall at the shoulder.	four
Fungal spores are usually about <mask> times larger than viral structures.	ten
Revolution is recommended for use in dogs and cats <mask> weeks of age and older.	six
Arbitration is a process where <mask> or three arbitrators make a decision about the case.	one
Arbitration is a process where one or <mask> arbitrators make a decision about the case.	three
Cords begin to form between the ages of <mask> and nine months.	six
Cords begin to form between the ages of six and <mask> months.	nine
Most people stay <mask> or four years, sometimes five or six years.	three
Most people stay three or <mask> years, sometimes five or six years.	four
Most people stay three or four years, sometimes <mask> or six years.	five
Most people stay three or four years, sometimes five or <mask> years.	six
Sound waves travel through the air in a similar manner, but in all <mask> dimensions.	three
Meteorologists divide California into <mask> different parts.	three
Tetrapods are animals that have <mask> legs or leg-like appendages.	four
Turkey has <mask> river basins.	seven
Humans generally produce <mask> pounds of waste in a single day.	five
Beavers live in colonies of <mask> to ten.	four
Food allergies impact <mask> to six percent of young children in America.	four
Food allergies impact four to <mask> percent of young children in America.	six
Men usually marry later in life because they have <mask> means of supporting a family.	no
Crickets are insects with <mask> legs and an exoskeleton.	six
Volcanoes form in <mask> places on the Earth.	two
Goblins usually travel in familly tribes of <mask> to a dozen goblins.	eight
Electromagnetic changes are at the speed of light and reach Earth within <mask> minutes.	eight
Political geography is organized or studied in <mask> scaled groups.	three
Individual beetles can live up to <mask> years.	three
Women are <mask> times more likely to experience carpal tunnel syndrome than men.	five
Neurons have <mask> types of axonal transport .	three
Balance is created by the equal presence of all <mask> energies acting at once.	four
Color triads is a color scheme composed of <mask> colors spaced equally apart on the color wheel.	three
Whales are thought to sleep around <mask> hours a day .	eight
Morocco has <mask> perennial rivers and many dams have been built with potential for power generation.	four
Islamic art shows <mask> representations of humans, birds or animals.	no
Beryllium is found in a variety of countries on <mask> continents.	five
Every person has <mask> kidneys.	two
Most beaver dams are less than <mask> feet high.	four
Enzymes often catalyze reactions with <mask> substrates and two products.	two
Enzymes often catalyze reactions with two substrates and <mask> products.	two
Reliability affects the production of goods in <mask> distinct ways.	three
Horns are pyramidal peaks that form when several cirques chisel a mountain from <mask> or more sides.	three
Fluorescent tubes make white light in <mask> stages.	two
Respect is the essential concept between any <mask> life-forms.	two
Osteoporosis is <mask> to four times more common in woman than men.	three
Osteoporosis is three to <mask> times more common in woman than men.	four
Healthy iguanas can easily reach <mask> feet, and subsequently require huge enclosures.	six
Embryos develop to fully formed first-stage larvae within about <mask> weeks.	three
Temperatures can, on occasion, fall well below freezing, however below <mask> temperatures are rare.	zero
Female fish have <mask> equally sized holes.	two
All passerines have <mask> toes on each foot.	four
CMYK images consist of the <mask> colors used to print color separations.	four
All plants take <mask> generations to complete one life cycle.	two
All plants take two generations to complete <mask> life cycle.	one
H chains have <mask> chains as previously described.	five
Diabetes comes in <mask> forms.	two
Marriage is a joining of <mask> hearts.	two
Human rights are key to people s lives for <mask> main reasons.	four
Males mature sexually as soon as <mask> years of age.	two
Beryllium has <mask> protons and four electrons.	four
Beryllium has four protons and <mask> electrons.	four
Harmony occurs when <mask> or more sounds are heard simultaneously.	two
Sleep is a restful state of the body when there is little or <mask> conscious thought.	no
Sugar cane is used to make rum at <mask> distilleries.	three
Many countries have <mask> laws against kiddie porn on the Internet.	no
All spiders have <mask> pairs of legs and a set of leg-like appendages called palps.	four
Saliva consists of <mask> fluids, 'mucous' and 'serous'.	two
Butterflies have <mask> legs and three body sections and they fly.	three
Butterflies have three legs and <mask> body sections and they fly.	three
Poodles have <mask> legs.	four
White sturgeon inhabit <mask> large river systems, all on the western coast of North America.	three
Rabbits can live to be around <mask> years old or older.	ten
Finbacks become sexually mature at around <mask> to thirteen years old.	ten
Psychology has <mask> means to deal with inherited behavioral disorders like addictions.	no
Yew is a small genus of about <mask> species scattered across North America, Europe, and Asia.	eight
Most ecosystems have only <mask> trophic levels, and the top carnivores are very rare.	four
HOD usually shows up as an acute lameness, often seeming to affect all <mask> legs simultaneously.	four
Most women have <mask> problems getting pregnant with a retroverted uterus.	no
Dolphins live in social groups of <mask> to several hundred.	five
Moths live less than <mask> weeks.	two
Human rabies is extremely rare, and there have been <mask> cases in Oregon in the last eight years.	no
Human rabies is extremely rare, and there have been no cases in Oregon in the last <mask> years.	eight
Holograms are photographs of the <mask> dimensional impressions stored on light waves.	three
True marriage is more than the joining of <mask> persons.	two
Today there are <mask> mating pairs.	four
Heart attacks strike <mask> in three people.	one
Heart attacks strike one in <mask> people.	three
Sponges have <mask> nervous system.	no
Fluorescent lamps are roughly <mask> times more intense than ordinary lightbulbs.	three
Plesiosaurs fall into <mask> groups.	two
Women are <mask> times more likely to have migraines.	three
Ozone is a molecule that is composed of <mask> oxygen atoms.	three
Germs have <mask> means of locomotion expect to attach themselves to particles of dust.	no
Spiders have <mask> tiny eyes.	eight
Intravenous form is used <mask> times a day and when an immediate effect of medicine is needed.	three
Acupuncture needles are about <mask> to three inches long.	two
Acupuncture needles are about two to <mask> inches long.	three
Billions have <mask> access to health care and education.	no
Tennis is day or night on <mask> all-weather courts.	two
Current statistics give a person living today a <mask> in three chance of dying from with cancer.	one
Current statistics give a person living today a one in <mask> chance of dying from with cancer.	three
Teeth begin to come in, or erupt, around age <mask> months.	six
Many children never have the love of <mask> parents.	two
Clovers occasionally have leaves with <mask> leaflets, instead of the usual three.	four
Most babies are ready for solid food between <mask> and six months of age unless premature.	four
Most babies are ready for solid food between four and <mask> months of age unless premature.	six
Climate covers minimum and maximum temperatures for all <mask> seasons.	four
Bulls usually don t breed until they re <mask> years old.	three
Soybeans have <mask> times the calcium of meat and twice that of eggs, and soybeans are low in fat.	ten
Dengue has an incubation period of <mask> to seven days after one is bitten by an infected mosquito.	five
Dengue has an incubation period of five to <mask> days after one is bitten by an infected mosquito.	seven
Dengue has an incubation period of five to seven days after <mask> is bitten by an infected mosquito.	one
White men can expect to live over <mask> years longer than black men.	seven
Sin has <mask> effects on every person's life.	two
Autism is present at birth and the characteristics become evident in the first <mask> years.	three
Turkey eggs are the size of <mask> chicken eggs.	two
Salmonella are just <mask> of the common foodborne diseases.	two
Babies can range in age from newborn up to <mask> years old.	three
Prairie dogs bear <mask> or five young per litter.	four
Prairie dogs bear four or <mask> young per litter.	five
Many bilingual people grow up speaking <mask> languages.	two
Young margays open their eyes <mask> weeks after birth.	two
Some amphibians dig deep burrows and stay there for up to <mask> months at a time.	nine
Japan is the second largest single country importer with about <mask> per cent of world oat imports.	five
Plants can spread to <mask> feet across when mature.	four
Some rusts produce up to <mask> different spore forms.	five
Scientific names consist of <mask> parts, hence they are binomial.	two
Hyphenated words are words that are formed from <mask> words.	two
Clothes moths go through <mask> distinct lifecycle periods with significant change at each stage.	four
Piglets normally grow about half their potential growth rate from birth to <mask> weeks of age.	three
Rabbits live an average of about <mask> years.	six
Fungi also participate in <mask> important symbiotic relationships.	two
Most lizards have eyelids, ear openings, <mask> legs and a tail.	four
Egg laying usually involves the formation of clutches of <mask> to six eggs.	four
Egg laying usually involves the formation of clutches of four to <mask> eggs.	six
Whitetail does give birth to anywhere from <mask> to six fawns each spring.	one
Whitetail does give birth to anywhere from one to <mask> fawns each spring.	six
Some people say sleeping through the night is midnight to <mask> o'clock.	five
Complementary opposites are <mask> colours juxtaposed on the colour wheel.	two
Most children enter kindergarten at the age of <mask> and are developing basic literacy skills.	five
Birds possess a <mask> chambered heart.	four
Arachnids have <mask> legs.	eight
Salt is spread when accumulations are under <mask> inches.	two
Breast cancer affects more than <mask> in eight women.	one
Breast cancer affects more than one in <mask> women.	eight
Squirrels otherwise appear to be safe and pose almost <mask> risk of transmitting rabies .	zero
Life is manifest in <mask> distinct states of existence.	four
Some fire stations house <mask> ambulances.	two
Veterinarians divide stringhalt into <mask> major categories.	two
Drip irrigation sends water straight to a plant's roots with virtually <mask> loss to evaporation.	no
Ethical consumerism has <mask> main effects.	three
Contract bridge is the basic form played by <mask> players, usually informally and socially.	four
Children drown quickly and silently - even in as little as <mask> centimetres of water.	five
Cubs weigh under <mask> pounds at birth and are striped.	three
Most women ovulate <mask> weeks after quitting the pill.	two
American anthropology has <mask> broad subfields.	four
Tesla coils are extremely dangerous and have killed <mask> people.	three
Declensional patterns are different among <mask> types of noun.	three
Most darters are less than <mask> inches long.	four
Tempera comes in <mask> forms - liquid, powder and blocks.	three
Sexual maturity is reached at about <mask> months of age.	nine
Porcine insulin has <mask> different amino acid and bovine insulin has three different amino acids.	one
Porcine insulin has one different amino acid and bovine insulin has <mask> different amino acids.	three
Prostate cancer can cause symptoms in <mask> main ways.	two
Snakes have <mask> layers of skin but only the outer, thinnest layer peels away when they shed.	three
Most bony fishes become sexually mature between <mask> and five years.	one
Most bony fishes become sexually mature between one and <mask> years.	five
Lightning is described as having <mask> parts.	two
Children often learn how to infuse themselves at the age of <mask> or ten.	eight
Uninsured people are more than <mask> times more likely to die in the hospital than the insured.	three
Serious offenses carry sentences of <mask> years or above.	seven
Schizophrenia is made up of probably <mask> or five different syndromes.	four
Schizophrenia is made up of probably four or <mask> different syndromes.	five
Common genets have <mask> distinct calls.	five
Fantails have <mask> horizontal lobes on their tails.	two
Violence is a part of all societies and there are <mask> societies without some level of violence.	no
Fluorescent lights are <mask> to four times more energy-efficient.	three
Fluorescent lights are three to <mask> times more energy-efficient.	four
Muslim men can divorce by simply pronouncing triple talak and can have up to <mask> wives.	four
Chaotic systems have at least <mask> solutions.	two
Digestive warmth is the key to the success of the entire process of keeping <mask> humors in balance.	three
Sharks use <mask> different methods of reproduction.	three
Llamas have an adorable way of laying down and tucking all <mask> legs underneath themselves.	four
Most amphibians have <mask> limbs.	four
Paraovarian cysts are of <mask> types i.e. mesothelial, paramesonephric or mesonephric.	three
Some people know from the age of <mask> that they want to set up their own business.	five
Cancer is home to <mask> open star clusters.	two
Many salad dressings contain <mask> or more grams of fat per Tablespoon.	eight
Lobsters use their <mask> pairs of antennas as sensors.	three
Organs arise from <mask> cell layers in the developing embryo.	three
Ozone is a highly reactive molecule that contains <mask> oxygen atoms.	three
Statistics show that women outlive their husbands by <mask> years.	seven
Consonant blends are <mask> letters together.	two
Sunfishes are characterized by deep bodies and <mask> spines in the anal fin.	three
Vomiting is present in up to <mask> thirds of patients.	two
Some homeopathic remedies are so dilute, <mask> molecules of the healing substance remain.	no
Cnidarians are radially symmetrical invertebrates with <mask> tissue layers.	two
Marriage is the bringing together of the <mask> sexes.	two
All limbs have <mask> digits.	five
Most prescription medications come in only <mask> or three sizes.	two
Most prescription medications come in only two or <mask> sizes.	three
Neutrinos do exist, in huge numbers, but all known neutrinos have <mask> mass.	zero
Women live an average of <mask> years longer than their spouses.	six
Marriages dissolve when <mask> lives are pointed in different directions.	two
Boys kill themselves <mask> times more often than girls.	five
Precious metals appear in the names of <mask> stories.	three
Protists are mostly microscopic and have <mask> organs or tissues.	no
Acorns require <mask> years to mature.	two
Sheep pox is a notifiable disease in the <mask> Maghreb countries.	four
Economists divide resources into <mask> basic categories - land, labor, capital and management.	four
Recordable CDs are different in that there are <mask> pits in the polycarbonate.	no
Nits typically hatch <mask> or nine days after they're laid.	eight
Nits typically hatch eight or <mask> days after they're laid.	nine
Atrial flutter is categorized into <mask> types.	two
Some niqabs have <mask> or two holes for the eyes.	one
Some niqabs have one or <mask> holes for the eyes.	two
Conglomerate integration is when <mask> apparently unconnected companies merge.	two
All plants are on their own roots, but there are <mask> signs of root rots.	no
High stress has the highest pitch, about <mask> notes above a vowel without a stress mark.	four
Epilepsy is defined as having <mask> or more unprovoked seizures.	two
History is the common language of the <mask> cultures.	two
Breeding involves the mixing of <mask> complete genomes.	two
Harvest season comes in about <mask> months after flowering.	three
Malaria is the leading killer, responsible for <mask> in five child deaths.	one
Malaria is the leading killer, responsible for one in <mask> child deaths.	five
Adult muskrats average <mask> foot in length and three pounds in weight.	one
Adult muskrats average one foot in length and <mask> pounds in weight.	three
Boys grow for about <mask> years after puberty starts .	six
Coefficients are positive numbers with up to <mask> decimal places.	two
Serious abuse can result in a prison sentence of from <mask> to eight years.	one
Serious abuse can result in a prison sentence of from one to <mask> years.	eight
Electrics usually have <mask> strings.	five
Royal jelly contains all <mask> essential amino acids.	eight
Twigs are moderate in diameter, brown, with half-round leaf scars with <mask> bundle scars.	three
Physicists now think of light in terms of photons, particles that have <mask> mass but carry momentum.	no
Ordinary tin is composed of <mask> stable isotopes.	nine
Adolescent boys are over <mask> times more likely to succeed than are adolescent girls.	four
Diabetic complications develop in nearly a third of patients within <mask> years of diagnosis.	ten
Humans produce <mask> times more melatonin at night then during the day.	five
White basswood grows in all <mask> States.	five
Triangle is a convex polygon with <mask> segments joining three non-collinear points.	three
Triangle is a convex polygon with three segments joining <mask> non-collinear points.	three
White infants are more than <mask> times as likely to be breast fed as black infants.	three
Parasitic nematodes are beneficial for <mask> reasons.	six
Vertebrates exhibit all <mask> of the chordate characteristics at some point during their lives.	three
Children show <mask> symptoms of lead poisoning until irreversible brain damage has occurred.	no
Most people develop antibodies within <mask> months and some can take up to six months.	three
Most people develop antibodies within three months and some can take up to <mask> months.	six
Tibetan medicine defines <mask> main systems which control the body's processes.	three
Most sharks have <mask> different kinds of fins, which lift, stabilze and propel the shark.	five
Lizards thrive in deserts, but <mask> reptiles can survive at all in polar ecosystems.	no
Women are the sole breadwinners in <mask> household in three worldwide.	one
Women are the sole breadwinners in one household in <mask> worldwide.	three
Stalks can grow up to <mask> feet tall.	ten
Walkers move around, sometimes alone and sometimes in groups of <mask> or more.	five
Human beings consist of body, soul, and spirit <mask> aspects or levels of existence.	three
Inland birds are <mask> less interesting and variable than the seabirds.	no
Semaphores have <mask> properties.	three
Baryons increase the mass of the fluid causing more infall and a net <mask> point displacement.	zero
Plants normally start to flower about <mask> years of age.	two
Most minor lacerations have minimal bleeding, minimal pain and <mask> numbness or tingling at the site.	no
Plant roots absorb <mask> vital nutrients.	three
Exports support <mask> out of every five manufacturing jobs in the United States.	one
Exports support one out of every <mask> manufacturing jobs in the United States.	five
Industrial consumers use over <mask> percent of the coal mined in the United States.	six
Copper is <mask> times higher in dog liver than in human liver.	ten
Mortality is high in affected puppies and most die of infection before <mask> months of age.	six
Medical abortions require <mask> doctors' visits, driving up the cost.	three
Whole blood contains all <mask> components and is sometimes used to treat acute hemorrhage patients.	four
Sexual reproduction is when offspring occur from <mask> parent cells.	two
Most electric meters have <mask> or five dials.	four
Most electric meters have four or <mask> dials.	five
Mollusks are the most numerous of the <mask> animals.	four
R contains <mask> eigenvectors.	four
Males typically live for <mask> years in the wild, and females for up to seventeen years.	ten
Normal cells have <mask> copies of each gene.	two
Syncretism is the fusion of <mask> or more religious systems.	two
Many starfish have <mask> arms, but there are some deep-water species that carry more than fifty.	five
Cockroaches can hold their breath for up to <mask> minutes.	seven
Swimmers have to be at least <mask> years old and comfortable in water.	seven
Smoking is a deadly addiction , responsible for <mask> million deaths each year.	three
